"Selected","Severity","DisplayName","Kind","Name","Description","RequiredDataConnectors","RuleFrequency","RulePeriod","RuleFrequency2","Version","Status"
" ","High","Probable AdFind Recon Tool Usage","Scheduled","c63ae777-d5e0-4113-8c9a-c2c9d3d09fcd","Identifies the host and account that executed AdFind by hash and filename in addition to common and unique flags that are used by many threat actors in discovery.","MicrosoftThreatProtection","Every 1 hour","Last 1 hour","",,"Available"
" ","Low","DNS events related to mining pools (Normalized DNS)","Scheduled","c094384d-7ea7-4091-83be-18706ecca981","Identifies IP addresses that may be performing DNS lookups associated with common currency mining pools.
To use this analytics rule, make sure you have deployed the [ASIM normalization parsers](https://aka.ms/AzSentinelDns)","","Every 1 day","Last 1 day","",,"Available"
" ","Informational","(Preview) Unusual web traffic detected with IP in URL path","Anomaly","1f6d7abe-2cb7-4a4c-aeca-91fe6bfad0b2","This algorithm identifies unusual web requests which have a direct IP address as the host. This can be an attempt to bypass URL reputation services etc for 
malicious purposes. The anomaly filters all web requests with IP addresses in the URL path and compares them with the previous week of data to exclude known benign traffic. 
After excluding known benign traffic, it triggers an anomaly only after exceeding certain thresholds with configured values such as total web requests, 
numbers of URLs seen with same host destination IP address, and number of distinct source IPs within the set of URLs with the same destination IP address.","PaloAltoNetworks|Zscaler|CEF|CheckPoint|Fortinet","","","Every 1 day",,"Available"
" ","Medium","GitHub Activites from a New Country","Scheduled","f041e01d-840d-43da-95c8-4188f6cef546","Detect activities from a location that was not recently or was never visited by the user or by any user in your organization.","","Every 1 day","Last 7 days","",,"Available"
" ","Informational","(Preview) Anomalous Azure operations","Anomaly","d7309cb9-b16b-4c7a-9e4b-3e9009bd373d","This detection algorithm generates anomaly of a caller who performed sequence of an operation(s) which is uncommon in their workspace.
We collect and featurize last 21 days of operation happened in the workspace grouped by the caller as a training data for ML algorithm.
The trained model is used to score the operation performed by the caller on the test date and we tag those caller as anomaly whose error score is greater than given thershold.
From Security perspective, this anomaly will capture the caller along with operation performed on the test date which are not common in their workspace.","AzureActivity","","","Every 1 day",,"Available"
" ","Medium","Base64 encoded Windows process command-lines (Normalized Process Events)","Scheduled","f8b3c49c-4087-499b-920f-0dcfaff0cbca","Identifies instances of a base64 encoded PE file header seen in the process command line parameter.
To use this analytics rule, make sure you have deployed the [ASIM normalization parsers](https://aka.ms/AzSentinelProcessEvent)","","Every 1 day","Last 1 day","",,"Available"
" ","Medium","Zoom E2E Encryption Disabled","Scheduled","e4779bdc-397a-4b71-be28-59e6a1e1d16b","This alerts when end to end encryption is disabled for Zoom meetings.","","Every 1 day","Last 1 day","",,"Available"
" ","Medium","TI map Domain entity to DnsEvent","Scheduled","85aca4d1-5d15-4001-abd9-acb86ca1786a","Identifies a match in DnsEvent table from any Domain IOC from TI","DNS|ThreatIntelligence|ThreatIntelligenceTaxii","Every 1 hour","Last 14 days","",,"Available"
" ","Medium","Excessive NXDOMAIN DNS Queries","Scheduled","b8266f81-2715-41a6-9062-42486cbc9c73","This creates an incident in the event a client generates excessive amounts of DNS queries for non-existent domains.","InfobloxNIOS","Every 1 hour","Last 1 hour","",,"Available"
" ","High","Alsid DCShadow","Scheduled","25e0b2dd-3ad3-4d5b-80dd-720f4ef0f12c","Searches for DCShadow attacks","AlsidForAD","Every 2 hours","Last 2 hours","",,"Available"
" ","Medium","Azure AD Health Service Agents Registry Keys Access","Scheduled","06bbf969-fcbe-43fa-bac2-b2fa131d113a","This detection uses Windows security events to detect suspicious access attempts to the registry key values and sub-keys of Azure AD Health service agents (e.g AD FS).
Information from AD Health service agents can be used to potentially abuse some of the features provided by those services in the cloud (e.g. Federation).
This detection requires an access control entry (ACE) on the system access control list (SACL) of the following securable object: HKLM:\SOFTWARE\Microsoft\ADHealthAgent.
Make sure you set the SACL to propagate to its sub-keys. You can find more information in here https://github.com/OTRF/Set-AuditRule/blob/master/rules/registry/aad_connect_health_service_agent.yml
","SecurityEvents","Every 1 day","Last 1 day","",,"Available"
" ","Medium","(Preview) TI map Domain entity to Dns Events (Normalized DNS)","Scheduled","999e9f5d-db4a-4b07-a206-29c4e667b7e8","Identifies a match in DNS events from any Domain IOC from TI
To use this analytics rule, make sure you have deployed the [ASIM normalization parsers](https://aka.ms/AzSentinelDns).","ThreatIntelligence|ThreatIntelligenceTaxii","Every 1 hour","Last 14 days","",,"Available"
" ","Medium","Gain Code Execution on ADFS Server via SMB + Remote Service or Scheduled Task","Scheduled","12dcea64-bec2-41c9-9df2-9f28461b1295","This query detects instances where an attacker has gained the ability to execute code on an ADFS Server through SMB and Remote Service or Scheduled Task.","SecurityEvents|WindowsSecurityEvents","Every 1 day","Last 7 days","",,"Available"
" ","Low","Palo Alto - potential beaconing detected","Scheduled","f0be259a-34ac-4946-aa15-ca2b115d5feb","Identifies beaconing patterns from Palo Alto Network traffic logs based on recurrent timedelta patterns. 
The query leverages various KQL functions to calculate time deltas and then compares it with total events observed in a day to find percentage of beaconing. 
This outbound beaconing pattern to untrusted public networks should be investigated for any malware callbacks or data exfiltration attempts.
Reference Blog:
http://www.austintaylor.io/detect/beaconing/intrusion/detection/system/command/control/flare/elastic/stack/2017/06/10/detect-beaconing-with-flare-elasticsearch-and-intrusion-detection-systems/","PaloAltoNetworks","Every 1 day","Last 1 day","",,"Available"
" ","Informational","(Preview) Detect machine generated network beaconing behavior","Anomaly","622844c2-fc11-4efc-91e6-c05b06ab3008","This algorithm identifies beaconing patterns from network traffic connection logs based on recurrent time delta patterns.
Any network connection towards the untrusted public networks at repetitive time delta is an indication of malware callbacks or data exfiltration attempts. 
The anomaly will calculate time delta between consecutive network connection between same source and destination ip as well as count (Connections in time-delta sequence) of 
time-delta sequence between same source and destination. Percentage of beaconing is calculated between connections in time-delta sequence against total connections in a day.","PaloAltoNetworks","","","Every 1 day",,"Available"
" ","Informational","(Preview) Suspicious volume of AWS API calls from Non-AWS source IP address from a user account id per workspace on a daily basis","Anomaly","32686052-5bed-48ef-9ffa-39fc7699f085","This algorithm detects an unusually high volume of AWS API calls from Source IPs not in AWS Source IP ranges from one user account per workspace within the last day. The model is trained on the previous 21 days of AWS cloud trail log events on source IP address basis. This activity may indicate that the user account is compromised.","AWS","","","Every 1 day",,"Available"
" ","Low","Threats detected by Eset","Scheduled","2d8a60aa-c15e-442e-9ce3-ee924889d2a6","Escalates threats detected by Eset.","EsetSMC","Every 5 minutes","Last 5 minutes","",,"Available"
" ","Low","Alsid privileged accounts issues","Scheduled","a5fe9489-cf8b-47ae-a87e-8f3a13e4203e","Searches for triggered Indicators of Exposures related to privileged accounts issues","AlsidForAD","Every 2 hours","Last 2 hours","",,"Available"
" ",,"Create incidents based on Azure Defender alerts","MicrosoftSecurityIncidentCreation","90586451-7ba8-4c1e-9904-7d1b7c3cc4d6","Create incidents based on all alerts generated in Azure Defender","AzureSecurityCenter","","","",,"Available"
" ","Medium","TI map URL entity to Syslog data","Scheduled","b31037ea-6f68-4fbd-bab2-d0d0f44c2fcf","Identifies a match in Syslog data from any URL IOC from TI","Syslog|ThreatIntelligence|ThreatIntelligenceTaxii","Every 1 hour","Last 14 days","",,"Available"
" ","Low","HAFNIUM Suspicious UM Service Error","Scheduled","0625fcce-6d52-491e-8c68-1d9b801d25b9","This query looks for errors that may indicate that an attacker is attempting to exploit a vulnerability in the service. 
Reference: https://www.microsoft.com/security/blog/2021/03/02/hafnium-targeting-exchange-servers/","","Every 1 day","Last 1 day","",,"Available"
" ","High","Known GALLIUM domains and hashes","Scheduled","26a3b261-b997-4374-94ea-6c37f67f4f39","GALLIUM command and control domains and hash values for tools and malware used by GALLIUM. 
 Matches domain name IOCs related to the GALLIUM activity group with CommonSecurityLog, DnsEvents, VMConnection and SecurityEvents dataTypes.
 References: https://www.microsoft.com/security/blog/2019/12/12/gallium-targeting-global-telecom/ ","DNS|AzureMonitor(VMInsights)|CiscoASA|PaloAltoNetworks|SecurityEvents|AzureFirewall","Every 1 day","Last 1 day","",,"Available"
" ","High","Known NICKEL domains and hashes","Scheduled","9122a9cb-916b-4d98-a199-1b7b0af8d598","IOC domains and hash values for tools and malware used by NICKEL. 
 Matches domain name, hash IOCs and M365 Defender sigs related to the NICKEL activity group with CommonSecurityLog, DnsEvents, VMConnection and SecurityEvents dataTypes.","DNS|AzureMonitor(VMInsights)|CiscoASA|PaloAltoNetworks|MicrosoftThreatProtection|MicrosoftThreatProtection|SecurityEvents|AzureFirewall","Every 1 day","Last 1 day","",,"Available"
" ","High","Alsid LSASS Memory","Scheduled","3acf5617-7c41-4085-9a79-cc3a425ba83a","Searches for OS Credentials dumping attacks","AlsidForAD","Every 2 hours","Last 2 hours","",,"Available"
" ","Medium","Mail.Read Permissions Granted to Application","Scheduled","2560515c-07d1-434e-87fb-ebe3af267760","This query look for applications that have been granted (Delegated or App/Role) permissions to Read Mail (Permissions field has Mail.Read) and subsequently has been consented to. This can help identify applications that have been abused to gain access to mailboxes.","AzureActiveDirectory","Every 1 day","Last 1 day","",,"Available"
" ","Medium","TI map IP entity to AzureNetworkAnalytics_CL (NSG Flow Logs)","Scheduled","a4025a76-6490-4e6b-bb69-d02be4b03f07","Identifies a match in AzureNetworkAnalytics_CL (NSG Flow Logs) from any IP IOC from TI that was Allowed","ThreatIntelligence|ThreatIntelligenceTaxii","Every 1 hour","Last 14 days","",,"Available"
" ","Medium","Network endpoint to host executable correlation","Scheduled","01f64465-b1ef-41ea-a7f5-31553a11ad43","Correlates blocked URLs hosting [malicious] executables with host endpoint data
to identify potential instances of executables of the same name having been recently run.","TrendMicro|SecurityEvents","Every 1 day","Last 1 day","",,"Available"
" ","Low","Suspicious Resource deployment","Scheduled","9fb57e58-3ed8-4b89-afcf-c8e786508b1c","Identifies when a rare Resource and ResourceGroup deployment occurs by a previously unseen Caller.","AzureActivity","Every 1 day","Last 14 days","",,"Available"
" ","Medium","New High Severity Vulnerability Detected Across Multiple Hosts","Scheduled","6116dc19-475a-4148-84b2-efe89c073e27","This creates an incident when a new high severity vulnerability is detected across multilple hosts","QualysVulnerabilityManagement","Every 1 hour","Last 1 hour","",,"Available"
" ","Medium","Email access via active sync","Scheduled","2f561e20-d97b-4b13-b02d-18b34af6e87c","This query detects attempts to add attacker devices as allowed IDs for active sync using the Set-CASMailbox command.
This technique was seen in relation to Solorigate attack but the results can indicate potential malicious activity used in different attacks.
- Note that this query can be changed to use the KQL """"has_all"""" operator, which hasn't yet been documented officially, but will be soon.
  In short, """"has_all"""" will only match when the referenced field has all strings in the list.
- Refer to Set-CASMailbox syntax: https://docs.microsoft.com/powershell/module/exchange/set-casmailbox?view=exchange-ps  ","SecurityEvents|MicrosoftThreatProtection","Every 1 day","Last 1 day","",,"Available"
" ","Low","Alsid user accounts issues","Scheduled","fb9e0b51-8867-48d7-86f4-6e76f2176bf8","Searches for triggered Indicators of Exposures related to user accounts issues","AlsidForAD","Every 2 hours","Last 2 hours","",,"Available"
" ","Informational","(Preview) Suspicious volume of logins to user account by logon types","Anomaly","29094df8-e0c7-4475-a74c-bda74a07affb","This algorithm detects an unusually high volume of successful logins per user account by different logon types. The model is trained on the previous 21 days of security event ID 4624 on an account. It indicates anomalous high volume of successful logins in the last day.","SecurityEvents","","","Every 1 day",,"Available"
" ","Medium","User Accounts - Sign in Failure due to CA Spikes","Scheduled","3a9d5ede-2b9d-43a2-acc4-d272321ff77c"," Identifies spike in failed sign-ins from user accounts due to conditional access policied.
Spike is determined based on Time series anomaly which will look at historical baseline values.
Ref : https://docs.microsoft.com/azure/active-directory/fundamentals/security-operations-user-accounts#monitoring-for-failed-unusual-sign-ins","AzureActiveDirectory|AzureActiveDirectory","Every 1 day","Last 1 day","",,"Available"
" ","Low","New user created and added to the built-in administrators group","Scheduled","aa1eff90-29d4-49dc-a3ea-b65199f516db","Identifies when a user account was created and then added to the builtin Administrators group in the same day.
This should be monitored closely and all additions reviewed.","SecurityEvents|WindowsSecurityEvents","Every 1 day","Last 1 day","",,"Available"
" ","High","Cognni Incidents for Highly Sensitive Legal Information","Scheduled","4f45f43b-3a4b-491b-9cbe-d649603384aa","Display incidents in which highly sensitive legal information was placed at risk by user sharing.","CognniSentinelDataConnector","Every 5 hours","Last 5 hours","",,"Available"
" ","Informational","(Preview) Suspicious volume of logins to user account","Anomaly","200f05a2-db6e-4ff7-be83-bbc30b44755f","This algorithm detects an unusually high volume of successful logins per user account. The model is trained on the previous 21 days of security event ID 4624 on an account. It indicates anomalous high volume of successful logins in the last day","SecurityEvents","","","Every 1 day",,"Available"
" ","Medium","High Number of Urgent Vulnerabilities Detected","Scheduled","3edb7215-250b-40c0-8b46-79093949242d","This Creates an incident when a host has a high number of Urgent, severity 5, vulnerabilities detected.","QualysVulnerabilityManagement","Every 1 hour","Last 1 hour","",,"Available"
" ","Medium","TI map Domain entity to CommonSecurityLog","Scheduled","dd0a6029-ecef-4507-89c4-fc355ac52111","Identifies a match in CommonSecurityLog table from any Domain IOC from TI","ThreatIntelligence|ThreatIntelligenceTaxii","Every 1 hour","Last 14 days","",,"Available"
" ","Medium","SharePointFileOperation via devices with previously unseen user agents","Scheduled","5dd76a87-9f87-4576-bab3-268b0e2b338b","Identifies if the number of documents uploaded or downloaded from device(s) associated
with a previously unseen user agent exceeds a threshold (default is 5).","Office365","Every 1 day","Last 14 days","",,"Available"
" ","Medium","New High Severity Vulnerability Detected Across Multiple Hosts","Scheduled","84cf1d59-f620-4fee-b569-68daf7008b7b","This creates an incident when a new high severity vulnerability is detected across multilple hosts","QualysVulnerabilityManagement","Every 1 hour","Last 1 hour","",,"Available"
" ","Medium","CoreBackUp Deletion in correlation with other related security alerts","Scheduled","011c84d8-85f0-4370-b864-24c13455aa94","This query will help detect attackers attempt to delete backup containers in correlation with other alerts that could have triggered to help possibly reveal more details of attacker activity. 
Though such an activity could be legitimate as part of business operation, some ransomware actors may perform such operation to cause interruption to regular business services.","AzureSecurityCenter","Every 1 day","Last 1 day","",,"Available"
" ","Medium","Cisco - firewall block but success logon to Azure AD","Scheduled","157c0cfc-d76d-463b-8755-c781608cdc1a","Correlate IPs blocked by a Cisco firewall appliance with successful Azure Active Directory signins. 
Because the IP was blocked by the firewall, that same IP logging on successfully to AAD is potentially suspect
and could indicate credential compromise for the user account.","CiscoASA|AzureActiveDirectory|AzureActiveDirectory","Every 1 day","Last 1 day","",,"Available"
" ","High","Known IRIDIUM IP","Scheduled","7ee72a9e-2e54-459c-bc8a-8c08a6532a63","IRIDIUM command and control IP. Identifies a match across various data feeds for IP IOCs related to the IRIDIUM activity group.","Office365|DNS|AzureMonitor(VMInsights)|CiscoASA|PaloAltoNetworks|SecurityEvents|AzureActiveDirectory|AzureActiveDirectory|AzureMonitor(IIS)|AzureActivity|AWS|AzureFirewall","Every 1 day","Last 1 day","",,"Available"
" ","High","Known Manganese IP and UserAgent activity","Scheduled","a04cf847-a832-4c60-b687-b0b6147da219","Matches IP plus UserAgent IOCs in OfficeActivity data, along with IP plus Connection string information in the CommonSecurityLog data related to Manganese group activity.
References: 
https://kb.pulsesecure.net/articles/Pulse_Security_Advisories/SA44101/
https://fortiguard.com/psirt/FG-IR-18-384","Office365","Every 1 day","Last 1 day","",,"Available"
" ","Medium","Successful logon from IP and failure from a different IP","Scheduled","02ef8d7e-fc3a-4d86-a457-650fa571d8d2","Identifies when a user account successfully logs onto an Azure App from one IP and within 10 mins failed to logon to the same App via a different IP.
This may indicate a malicious attempt at password guessing based on knowledge of the users account.","AzureActiveDirectory|AzureActiveDirectory","Every 1 day","Last 1 day","",,"Available"
" ","Low","Squid proxy events for ToR proxies","Scheduled","90d3f6ec-80fb-48e0-9937-2c70c9df9bad","Check for Squid proxy events associated with common ToR proxies. This query presumes the default squid log format is being used.
http://www.squid-cache.org/Doc/config/access_log/","Syslog","Every 1 day","Last 1 day","",,"Available"
" ","Medium","Exchange workflow MailItemsAccessed operation anomaly","Scheduled","b4ceb583-4c44-4555-8ecf-39f572e827ba","Identifies anomalous increases in Exchange mail items accessed operations.
The query leverages KQL built-in anomaly detection algorithms to find large deviations from baseline patterns.
Sudden increases in execution frequency of sensitive actions should be further investigated for malicious activity.
Manually change scorethreshold from 1.5 to 3 or higher to reduce the noise based on outliers flagged from the query criteria.
Read more about MailItemsAccessed- https://docs.microsoft.com/microsoft-365/compliance/advanced-audit?view=o365-worldwide#mailitemsaccessed","Office365","Every 1 day","Last 14 days","",,"Available"
" ","High","Azure AD Role Management Permission Grant","Scheduled","1ff56009-db01-4615-8211-d4fda21da02d","Identifies when the Microsoft Graph RoleManagement.ReadWrite.Directory (Delegated or Application) permission is granted to a service principal.
This permission allows an application to read and manage the role-based access control (RBAC) settings for your company's directory.
An adversary could use this permission to add an Azure AD object to an Admin directory role and escalate privileges.
Ref : https://docs.microsoft.com/graph/permissions-reference#role-management-permissions
Ref : https://docs.microsoft.com/graph/api/directoryrole-post-members?view=graph-rest-1.0&tabs=http","AzureActiveDirectory","Every 2 hours","Last 2 hours","",,"Available"
" ","Medium","Trust Monitor Event","Scheduled","8dcf7238-a7d0-4cfd-8d0c-b230e3cd9182","This query identifies when a new trust monitor event is detected.","","Every 5 minutes","Last 5 minutes","",,"Available"
" ","Low","Changes to internet facing AWS RDS Database instances","Scheduled","8c2ef238-67a0-497d-b1dd-5c8a0f533e25","Amazon Relational Database Service (RDS) is scalable relational database in the cloud. 
If your organization have one or more AWS RDS Databases running, monitoring changes to especially internet facing AWS RDS (Relational Database Service) 
Once alerts triggered, validate if changes observed are authorized and adhere to change control policy. 
More information: https://medium.com/@GorillaStack/the-most-important-aws-cloudtrail-security-events-to-track-a5b9873f8255
and RDS API Reference Docs: https://docs.aws.amazon.com/AmazonRDS/latest/APIReference/API_Operations.html","AWS","Every 1 day","Last 1 day","",,"Available"
" ","High","Known ZINC Comebacker and Klackring malware hashes","Scheduled","09551db0-e147-4a0c-9e7b-918f88847605","ZINC attacks against security researcher campaign malware hashes.","DNS|AzureMonitor(VMInsights)|CiscoASA|PaloAltoNetworks|SecurityEvents|MicrosoftThreatProtection|MicrosoftThreatProtection|MicrosoftThreatProtection|AzureFirewall","Every 1 day","Last 1 day","",,"Available"
" ","Medium","TI map File Hash to Security Event","Scheduled","a7427ed7-04b4-4e3b-b323-08b981b9b4bf","Identifies a match in Security Event data from any File Hash IOC from TI","SecurityEvents|ThreatIntelligence|ThreatIntelligenceTaxii","Every 1 hour","Last 14 days","",,"Available"
" ","Medium","Failed logon attempts in authpriv","Scheduled","e7ec9fa6-e7f7-41ed-a34b-b956837a3ee6","Identifies failed logon attempts from unknown users in Syslog authpriv logs. The unknown user means the account that tried to log in 
isn't provisioned on the machine. A few hits could indicate someone attempting to access a machine they aren't authorized to access. 
If there are many of hits, especially from outside your network, it could indicate a brute force attack. 
Default threshold for logon attempts is 15.","Syslog","Every 1 day","Last 1 day","",,"Available"
" ","Medium","Explicit MFA Deny","Scheduled","a22740ec-fc1e-4c91-8de6-c29c6450ad00","User explicitly denies MFA push, indicating that login was not expected and the account's password may be compromised.","AzureActiveDirectory|AzureActiveDirectory","Every 1 day","Last 1 day","",,"Available"
" ","Informational","(Preview) Anomalous user/app activities in Azure audit logs","Anomaly","3dccf381-2bb2-40c6-81a0-ab878bdf323f","This autoencoder model identifies anomalous user/app Azure sessions in audit logs for the last day.
We define 10 minutes to be the length of a session.
It groups the Azure audit logs on a per-user/app basis into sessions.
It compresses these user/app Azure sessions into a bottleneck encoding.
It then reconstructs the input sessions as best it can from the bottleneck encoding.
If the sessions have high reconstruction errors, they are assumed to be anomalous.
The model is trained on the previous 21 days of behavior across all users and apps.
This algorithm checks for sufficient volume of data before training the model.","AzureActiveDirectory","","","Every 1 day",,"Available"
" ","Low","Possible STRONTIUM attempted credential harvesting - Oct 2020","Scheduled","68271db2-cbe9-4009-b1d3-bb3b5fe5713c","Surfaces potential STRONTIUM group Office365 credential harvesting attempts within OfficeActivity Logon events.","Office365","Every 7 days","Last 14 days","",,"Available"
" ","Medium","Cisco Umbrella - Request to blocklisted file type","Scheduled","de58ee9e-b229-4252-8537-41a4c2f4045e","Detects request to potentially harmful file types (.ps1, .bat, .vbs, etc.).","CiscoUmbrellaDataConnector","Every 10 minutes","Last 10 minutes","",,"Available"
" ","Medium","Potential communication with a Domain Generation Algorithm (DGA) based hostname (ASIM Web Session schema)","Scheduled","9176b18f-a946-42c6-a2f6-0f6d17cd6a8a","This rule identifies communication with hosts that have a domain name that might have been generated by a Domain Generation Algorithm (DGA). DGAs are used by malware to generate rendezvous points that are difficult to predict in advance. This detection uses the top 1 million domain names to build a model of what normal domains look like nad uses the model to identify domains that may have been randomly generated by an algorithm. You can modify the triThreshold and dgaLengthThreshold query parameters to change Analytic Rule sensitivity. The higher the numbers, the less noisy the rule is. <br>This rule uses the [Advanced SIEM Information Model (ASIM)](https://aka.ms/AboutASIM) and supports any network session source that compiles with ASIM. To use this Analytics Rule, [deploy the Advanced SIEM information Model (ASIM)](https://aka.ms/DeployASIM).","","Every 6 hours","Last 6 hours","",,"Available"
