"Selected","Severity","DisplayName","Kind","Name","Description","RequiredDataConnectors","RuleFrequency","RulePeriod","RuleFrequency2","Version","Status"
" ","High","TEARDROP memory-only dropper","Scheduled","738702fd-0a66-42c7-8586-e30f0583f8fe","Identifies SolarWinds TEARDROP memory-only dropper IOCs in Window's defender Exploit Guard activity
References:
- https://www.fireeye.com/blog/threat-research/2020/12/evasive-attacker-leverages-solarwinds-supply-chain-compromises-with-sunburst-backdoor.html
- https://gist.github.com/olafhartong/71ffdd4cab4b6acd5cbcd1a0691ff82f","MicrosoftThreatProtection","Every 1 day","Last 1 day","",,"Available"
" ","High","Exchange SSRF Autodiscover ProxyShell - Detection","Scheduled","968358d6-6af8-49bb-aaa4-187b3067fb95","This query looks for suspicious request patterns to Exchange servers that fit patterns recently
blogged about by PeterJson. This exploitation chain utilises an SSRF vulnerability in Exchange
which eventually allows the attacker to execute arbitrary Powershell on the server. In the example
powershell can be used to write an email to disk with an encoded attachment containing a shell.
Reference: https://peterjson.medium.com/reproducing-the-proxyshell-pwn2own-exploit-49743a4ea9a1","AzureMonitor(IIS)","Every 12 hours","Last 12 hours","",,"Available"
" ","Medium","TI map IP entity to DnsEvents","Scheduled","69b7723c-2889-469f-8b55-a2d355ed9c87","Identifies a match in DnsEvents from any IP IOC from TI","ThreatIntelligence|ThreatIntelligenceTaxii|DNS","Every 1 hour","Last 14 days","",,"Available"
" ","Low","Login to AWS Management Console without MFA","Scheduled","d25b1998-a592-4bc5-8a3a-92b39eedb1bc","Multi-Factor Authentication (MFA) helps you to prevent credential compromise. This alert identifies logins to the AWS Management Console without MFA.
You can limit this detection to trigger for adminsitrative accounts if you do not have MFA enabled on all accounts.
This is done by looking at the eventName ConsoleLogin and if the AdditionalEventData field indicates MFA was NOT used 
and the ResponseElements field indicates NOT a Failure. Thereby indicating that a non-MFA login was successful.","AWS","Every 1 day","Last 1 day","",,"Available"
" ","Medium","Vectra AI Detect - Suspected Compromised Account","Scheduled","321f9dbd-64b7-4541-81dc-08cf7732ccb0","Create an incident when an Account is suspected to be compromised. 
The higher the severity level is, the more immediate attention it requires as Vectra AI engine is more confident that this is a real threat. 
Level of severity are: Low, Medium, High, Critical). Recommended configuration is to trigger an alert for at least High and Critical.","AIVectraDetect","Every 1 hour","Last 1 hour","",,"Available"
" ","Medium","Failed Logins from Unknown or Invalid User","Scheduled","884be6e7-e568-418e-9c12-89229865ffde","This query searches for numerous login attempts to the management console with an unknown or invalid user name","OktaSSO","Every 1 hour","Last 1 hour","",,"Available"
" ","Informational","(Preview) Unusual external firewall alarm detected","Anomaly","213252f1-497c-4124-91da-6cb43902d5b1","This algorithm identifies unusual external firewall alarms which are threat signatures released by a firewall vendor. 
The anomaly takes last 7 days activities to calculate top 10 noisy signatures and also noisy source hosts which are repeatedly seen 
triggering threat signatures. After excluding both type of noisy events, it triggers an anomaly only after exceeding the threshold of 
number of signatures triggered in a single day.","PaloAltoNetworks","","","Every 1 day",,"Available"
" ","Medium","Detect PIM Alert Disabling activity","Scheduled","1f3b4dfd-21ff-4ed3-8e27-afc219e05c50","Privileged Identity Management (PIM) generates alerts when there is suspicious or unsafe activity in Azure Active Directory (Azure AD) organization. 
This query will help detect attackers attempts to disable in product PIM alerts which are associated with Azure MFA requirements and could indicate activation of privileged access","AzureActiveDirectory","Every 1 day","Last 1 day","",,"Available"
" ","Low","ProofpointPOD - Weak ciphers","Scheduled","56b0a0cd-894e-4b38-a0a1-c41d9f96649a","Detects when weak TLS ciphers are used.","ProofpointPOD","Every 1 hour","Last 1 hour","",,"Available"
" ","Low","External User Access Enabled","Scheduled","8e267e91-6bda-4b3c-bf68-9f5cbdd103a3","This alerts when the account setting is changed to allow either external domain access or anonymous access to meetings.","","Every 1 day","Last 1 day","",,"Available"
" ","High","Alsid Password Guessing","Scheduled","ba239935-42c2-472d-80ba-689186099ea1","Searches for bruteforce Password Guessing attacks","AlsidForAD","Every 2 hours","Last 2 hours","",,"Available"
" ","High","User login from different countries within 3 hours (Uses Authentication Normalization)","Scheduled","09ec8fa2-b25f-4696-bfae-05a7b85d7b9e","This query searches for successful user logins from different countries within 3 hours.
 To use this analytics rule, make sure you have deployed the [ASIM normalization parsers](https://aka.ms/AzSentinelAuthentication)","","Every 3 hours","Last 3 hours","",,"Available"
" ","Informational","(Preview) Anomalous Sign In","Anomaly","bb32dc8a-4f6b-4274-a28f-50f3400070b4","Adversaries may steal the credentials of a specific user or service account using Credential
Access techniques or capture credentials earlier in their reconnaissance process through
social engineering for means of gaining Persistence. Sentinel UEBA detects anomalies based on dynamic baselines created for each entity across various data inputs. Each entity’s baseline behavior is set according to its own historical activities, those of its peers, and those of the organization as a whole. Anomalies can be triggered by the correlation of different attributes such as action type, geo-location, device, resource, ISP, and more.","AzureActiveDirectory|SecurityEvents","","","Every 1 day",,"Available"
" ","Medium","High count of failed logons by a user","Scheduled","884c4957-70ea-4f57-80b9-1bca3890315b","Identifies when 100 or more failed attempts by a given user in 10 minutes occur on the IIS Server.
This could be indicative of attempted brute force based on known account information.
This could also simply indicate a misconfigured service or device. 
References:
IIS status code mapping - https://support.microsoft.com/help/943891/the-http-status-code-in-iis-7-0-iis-7-5-and-iis-8-0
Win32 Status code mapping - https://msdn.microsoft.com/library/cc231199.aspx","AzureMonitor(IIS)","Every 1 day","Last 1 day","",,"Available"
" ","Medium","ProofpointPOD - Email sender IP in TI list","Scheduled","78979d32-e63f-4740-b206-cfb300c735e0","Email sender IP in TI list.","ThreatIntelligence|ThreatIntelligenceTaxii|ProofpointPOD","Every 1 day","Last 14 days","",,"Available"
" ","Medium","Brute force attack against Azure Portal","Scheduled","28b42356-45af-40a6-a0b4-a554cdfd5d8a","Identifies evidence of brute force activity against Azure Portal by highlighting multiple authentication failures 
and by a successful authentication within a given time window. 
(The query does not enforce any sequence - eg requiring the successful authentication to occur last.)
Default Failure count is 5, Default Success count is 1 and default Time Window is 20 minutes.
References: https://docs.microsoft.com/azure/active-directory/reports-monitoring/reference-sign-ins-error-codes.","AzureActiveDirectory|AzureActiveDirectory","Every 1 day","Last 1 day","",,"Available"
" ","High","Authentication Methods Changed for Privileged Account","Scheduled","694c91ee-d606-4ba9-928e-405a2dd0ff0f","Identifies authentication methods being changed for a privileged account. This could be an indicated of an attacker adding an auth method to the account so they can have continued access.
Ref : https://docs.microsoft.com/azure/active-directory/fundamentals/security-operations-privileged-accounts#things-to-monitor-1","AzureActiveDirectory","Every 2 hours","Last 14 days","",,"Available"
" ","Informational","(Preview) Unusual network communication on commonly used ports","Anomaly","ae9128e8-2740-4b62-8bde-54e62b183fca","This algorithm identifies unusual network communication on commonly used ports, comparing daily traffic to a baseline from the previous 7 days.
This includes traffic on commonly used ports (22, 53, 80, 443, 8080, 8888), and compares daily traffic to the mean and standard deviation of several
network traffic attributes calculated over the baseline period. The traffic attributes considered are daily total events, daily data transfer and 
number of distinct destination IP addresses per port. An anomaly is triggered when the daily values are greater than the configured number of standard deviations above the mean.","PaloAltoNetworks|CheckPoint|Fortinet","","","Every 1 day",,"Available"
" ","Medium","ProofpointPOD - Email sender in TI list","Scheduled","35a0792a-1269-431e-ac93-7ae2980d4dde","Email sender in TI list.","ThreatIntelligence|ThreatIntelligenceTaxii|ProofpointPOD","Every 1 day","Last 14 days","",,"Available"
" ","High","SUNBURST and SUPERNOVA backdoor hashes (Normalized File Events)","Scheduled","bc5ffe2a-84d6-48fe-bc7b-1055100469bc","Identifies SolarWinds SUNBURST and SUPERNOVA backdoor file hash IOCs in File Events
To use this analytics rule, make sure you have deployed the [ASIM normalization parsers](https://aka.ms/AzSentinelFileEvent)
References:
- https://www.fireeye.com/blog/threat-research/2020/12/evasive-attacker-leverages-solarwinds-supply-chain-compromises-with-sunburst-backdoor.html
- https://gist.github.com/olafhartong/71ffdd4cab4b6acd5cbcd1a0691ff82f","","Every 1 day","Last 1 day","",,"Available"
" ","Low","AD user enabled and password not set within 48 hours","Scheduled","62085097-d113-459f-9ea7-30216f2ee6af","Identifies when an account is enabled with a default password and the password is not set by the user within 48 hours.
Effectively, there is an event 4722 indicating an account was enabled and within 48 hours, no event 4723 occurs which 
indicates there was no attempt by the user to set the password. This will show any attempts (success or fail) that occur 
after 48 hours, which can indicate too long of a time period in setting the password to something that only the user knows.
It is recommended that this time period is adjusted per your internal company policy.","SecurityEvents|WindowsSecurityEvents","Every 1 day","Last 3 days","",,"Available"
" ","High","Solorigate Named Pipe","Scheduled","11b4c19d-2a79-4da3-af38-b067e1273dee","Identifies a match across various data feeds for named pipe IOCs related to the Solorigate incident.
 For the sysmon events required for this detection, logging for Named Pipe Events needs to be configured in Sysmon config (Event ID 17 and Event ID 18)
 Reference: https://techcommunity.microsoft.com/t5/azure-sentinel/solarwinds-post-compromise-hunting-with-azure-sentinel/ba-p/1995095","SecurityEvents|WindowsSecurityEvents","Every 1 day","Last 1 day","",,"Available"
" ","Low","Creation of expensive computes in Azure","Scheduled","9736e5f1-7b6e-4bfb-a708-e53ff1d182c3","Identifies the creation of large size/expensive VMs (GPU or with large no of virtual CPUs) in Azure.
Adversary may create new or update existing virtual machines sizes to evade defenses 
or use it for cryptomining purposes.
For Windows/Linux Vm Sizes - https://docs.microsoft.com/azure/virtual-machines/windows/sizes 
Azure VM Naming Conventions - https://docs.microsoft.com/azure/virtual-machines/vm-naming-conventions","AzureActivity","Every 1 day","Last 1 day","",,"Available"
" ","Medium","TI map IP entity to OfficeActivity","Scheduled","f15370f4-c6fa-42c5-9be4-1d308f40284e","Identifies a match in OfficeActivity from any IP IOC from TI","ThreatIntelligence|ThreatIntelligenceTaxii|Office365","Every 1 hour","Last 14 days","",,"Available"
" ","Medium","TI map Email entity to CommonSecurityLog","Scheduled","ffcd575b-3d54-482a-a6d8-d0de13b6ac63","Identifies a match in CommonSecurityLog table from any Email IOC from TI","PaloAltoNetworks|ThreatIntelligence|ThreatIntelligenceTaxii","Every 1 hour","Last 14 days","",,"Available"
" ","High","Azure VM Run Command operation executed during suspicious login window","Scheduled","11bda520-a965-4654-9a45-d09f372f71aa","Identifies when the Azure Run Command operation is executed by a UserPrincipalName and IP Address  
that has resulted in a recent user entity behaviour alert.","AzureActivity","Every 1 day","Last 2 days","",,"Available"
" ","Medium","ADFS DKM Master Key Export","Scheduled","18e6a87e-9d06-4a4e-8b59-3469cd49552d","Identifies an export of the ADFS DKM Master Key from Active Directory.
References: https://blogs.microsoft.com/on-the-issues/2020/12/13/customers-protect-nation-state-cyberattacks/, 
https://www.fireeye.com/blog/threat-research/2020/12/evasive-attacker-leverages-solarwinds-supply-chain-compromises-with-sunburst-backdoor.html?1
To understand further the details behind this detection, please review the details in the original PR and subequent PR update to this:
https://github.com/Azure/Azure-Sentinel/pull/1562#issue-551542469
https://github.com/Azure/Azure-Sentinel/pull/1512#issue-543053339
","SecurityEvents|MicrosoftThreatProtection","Every 1 day","Last 1 day","",,"Available"
" ","Medium","MFA disabled for a user","Scheduled","65c78944-930b-4cae-bd79-c3664ae30ba7","Multi-Factor Authentication (MFA) helps prevent credential compromise. This alert identifies when an attempt has been made to disable MFA for a user ","AzureActiveDirectory|AWS","Every 1 hour","Last 1 hour","",,"Available"
" ","High","Modified domain federation trust settings","Scheduled","95dc4ae3-e0f2-48bd-b996-cdd22b90f9af","This will alert when a user or application modifies the federation settings on the domain or Update domain authentication from Managed to Federated.
For example, this alert will trigger when a new Active Directory Federated Service (ADFS) TrustedRealm object, such as a signing certificate, is added to the domain.
Modification to domain federation settings should be rare. Confirm the added or modified target domain/URL is legitimate administrator behavior.
To understand why an authorized user may update settings for a federated domain in Office 365, Azure, or Intune, see: https://docs.microsoft.com/office365/troubleshoot/active-directory/update-federated-domain-office-365.
For details on security realms that accept security tokens, see the ADFS Proxy Protocol (MS-ADFSPP) specification: https://docs.microsoft.com/openspecs/windows_protocols/ms-adfspp/e7b9ea73-1980-4318-96a6-da559486664b.
For further information on AuditLogs please see https://docs.microsoft.com/azure/active-directory/reports-monitoring/reference-audit-activities.","AzureActiveDirectory","Every 1 day","Last 1 day","",,"Available"
" ","Medium","Audit policy manipulation using auditpol utility","Scheduled","66276b14-32c5-4226-88e3-080dacc31ce1","This detects attempt to manipulate audit policies using auditpol command.
This technique was seen in relation to Solorigate attack but the results can indicate potential  malicious activity used in different attacks.
The process name in each data source is commented out as an adversary could rename it. It is advisable to keep process name commented but 
if the results show unrelated false positives, users may want to uncomment it.
Refer to auditpol syntax: https://docs.microsoft.com/windows-server/administration/windows-commands/auditpol  
Refer to our M365 blog for details on use during the Solorigate attack:
https://www.microsoft.com/security/blog/2021/01/20/deep-dive-into-the-solorigate-second-stage-activation-from-sunburst-to-teardrop-and-raindrop/","SecurityEvents|MicrosoftThreatProtection","Every 1 day","Last 1 day","",,"Available"
" ","Low","Squid proxy events related to mining pools","Scheduled","80733eb7-35b2-45b6-b2b8-3c51df258206","Checks for Squid proxy events in Syslog associated with common mining pools .This query presumes the default Squid log format is being used. 
 http://www.squid-cache.org/Doc/config/access_log/","Syslog","Every 1 day","Last 1 day","",,"Available"
" ","Low","External user added and removed in short timeframe","Scheduled","bff093b2-500e-4ae5-bb49-a5b1423cbd5b","This detection flags the occurances of external user accounts that are added to a Team and then removed within
one hour.","Office365","Every 1 hour","Last 1 hour","",,"Available"
" ","Medium","High Number of Urgent Vulnerabilities Detected","Scheduled","be52662c-3b23-435a-a6fa-f39bdfc849e6","This Creates an incident when a host has a high number of Urgent, severity 5, vulnerabilities detected.","QualysVulnerabilityManagement","Every 1 hour","Last 1 hour","",,"Available"
" ","Medium","ProofpointPOD - Binary file in attachment","Scheduled","eb68b129-5f17-4f56-bf6d-dde48d5e615a","Detects when email recieved with binary file as attachment.","ProofpointPOD","Every 10 minutes","Last 10 minutes","",,"Available"
" ","Medium","Cognni Incidents for Medium Sensitivity Financial Information","Scheduled","d29b1d66-d4d9-4be2-b607-63278fc4fe6b","Display incidents in which medium sensitive financial information was placed at risk by user sharing.","CognniSentinelDataConnector","Every 5 hours","Last 5 hours","",,"Available"
" ","Informational","(Preview) Domain generation algorithm (DGA) on DNS domains","Anomaly","b783df9c-4088-452e-a791-0c4fca47a109","This machine learning model indicates potential DGA domains in the second-level-domain (SLD) from the last day in the DNS logs.
The algorithm applies to the DNS records that resolve to IPv4 and IPv6 addresses.","DNS","","","Every 1 day",,"Available"
" ","High","PIM Elevation Request Rejected","Scheduled","7d7e20f8-3384-4b71-811c-f5e950e8306c","Identifies when a user is rejected for a privileged role elevation via PIM. Monitor rejections for indicators of attacker compromise of the requesting account.
Ref : https://docs.microsoft.com/azure/active-directory/fundamentals/security-operations-privileged-identity-management","AzureActiveDirectory","Every 2 hours","Last 2 hours","",,"Available"
" ","Medium","NOBELIUM - suspicious rundll32.exe execution of vbscript","Scheduled","d82e1987-4356-4a7b-bc5e-064f29b143c0","This query idenifies when rundll32.exe executes a specific set of inline VBScript commands
 References: https://www.microsoft.com/security/blog/2021/03/04/goldmax-goldfinder-sibot-analyzing-nobelium-malware/","SecurityEvents|WindowsSecurityEvents","Every 1 day","Last 1 day","",,"Available"
" ","Medium","Password spray attack against Azure AD application","Scheduled","48607a29-a26a-4abf-8078-a06dbdd174a4","Identifies evidence of password spray activity against Azure AD applications by looking for failures from multiple accounts from the same
IP address within a time window. If the number of accounts breaches the threshold just once, all failures from the IP address within the time range
are bought into the result. Details on whether there were successful authentications by the IP address within the time window are also included.
This can be an indicator that an attack was successful.
The default failure acccount threshold is 5, Default time window for failures is 20m and default look back window is 3 days
Note: Due to the number of possible accounts involved in a password spray it is not possible to map identities to a custom entity.
References: https://docs.microsoft.com/azure/active-directory/reports-monitoring/reference-sign-ins-error-codes.","AzureActiveDirectory|AzureActiveDirectory","Every 1 day","Last 7 days","",,"Available"
" ","Medium","Cognni Incidents for Medium Sensitivity Business Information","Scheduled","2c286288-3756-4824-b599-d3c499836c11","Display incidents in which medium sensitivity business information was placed at risk by user sharing.","CognniSentinelDataConnector","Every 5 hours","Last 5 hours","",,"Available"
" ","Medium","Rare application consent","Scheduled","83ba3057-9ea3-4759-bf6a-933f2e5bc7ee","This will alert when the """"Consent to application"""" operation occurs by a user that has not done this operation before or rarely does this.
This could indicate that permissions to access the listed Azure App were provided to a malicious actor. 
Consent to application, Add service principal and Add OAuth2PermissionGrant should typically be rare events. 
This may help detect the Oauth2 attack that can be initiated by this publicly available tool - https://github.com/fireeye/PwnAuth
For further information on AuditLogs please see https://docs.microsoft.com/azure/active-directory/reports-monitoring/reference-audit-activities.","AzureActiveDirectory","Every 1 day","Last 7 days","",,"Available"
" ","Low","SSH - Potential Brute Force","Scheduled","e1ce0eab-10d1-4aae-863f-9a383345ba88","Identifies an IP address that had 15 failed attempts to sign in via SSH in a 4 hour block during a 24 hour time period.","Syslog","Every 1 day","Last 1 day","",,"Available"
" ",,"Create incidents based on Azure Active Directory Identity Protection alerts","MicrosoftSecurityIncidentCreation","532c1811-79ee-4d9f-8d4d-6304c840daa1","Create incidents based on all alerts generated in Azure Active Directory Identity Protection","AzureActiveDirectoryIdentityProtection","","","",,"Available"
" ","Informational","(Preview) Suspicious volume of AWS write API calls from a user account ","Anomaly","0c804654-63b9-4241-89f8-1cddd7e9cacd","This algorithm detects an unusually high volume of AWS write API calls per user account within the last day. The model is trained on the previous 21 days of AWS cloud trail log events on a user account basis. This activity may indicate that the account is compromised.","AWS","","","Every 1 day",,"Available"
" ","Low","Changes to Amazon VPC settings","Scheduled","65360bb0-8986-4ade-a89d-af3cf44d28aa","Amazon Virtual Private Cloud (Amazon VPC) lets you provision a logically isolated section of the AWS Cloud where you can launch AWS resources
in a virtual network that you define.
This identifies changes to Amazon VPC (Virtual Private Cloud) settings such as new ACL entries,routes, routetable or Gateways.
More information: https://medium.com/@GorillaStack/the-most-important-aws-cloudtrail-security-events-to-track-a5b9873f8255 
and AWS VPC API Docs: https://docs.aws.amazon.com/AWSEC2/latest/APIReference/OperationList-query-vpc.html","AWS","Every 1 day","Last 1 day","",,"Available"
" ","Medium","Potential Build Process Compromise","Scheduled","5ef06767-b37c-4818-b035-47de950d0046","The query looks for source code files being modified immediately after a build process is started. The purpose of this is to look for malicious code injection during the build process.
More details: https://techcommunity.microsoft.com/t5/azure-sentinel/monitoring-the-software-supply-chain-with-azure-sentinel/ba-p/2176463","SecurityEvents|WindowsSecurityEvents","Every 1 day","Last 1 day","",,"Available"
" ","Informational","(Preview) Potential domain generation algorithm (DGA) on next-level DNS Domains","Anomaly","7e38a3e4-ccb9-4c73-b4ee-290b3bed077c","This machine learning model indicates the next-level domains (third-level and up)
of the domain names from the last day of DNS logs are unusual. They could potentially be the output of a domain generation
algorithm (DGA). The anomaly applies to the DNS records that resolve to IPv4 and IPv6 addresses.","DNS","","","Every 1 day",,"Available"
" ","Medium","TI map Domain entity to PaloAlto","Scheduled","ec21493c-2684-4acd-9bc2-696dbad72426","Identifies a match in Palo Alto data in CommonSecurityLog table from any Domain IOC from TI","PaloAltoNetworks|ThreatIntelligence|ThreatIntelligenceTaxii","Every 1 hour","Last 14 days","",,"Available"
" ","Low","Users searching for VIP user activity","Scheduled","f7f4a77e-f68f-4b56-9aaf-a0c9d87d7a8e","This query monitors for users running Log Analytics queries that contain filters
for specific, defined VIP user accounts or the VIPUser watchlist template.
Use this detection to alert for users specifically searching for activity of sensitive users.","","Every 1 day","Last 1 day","",,"Available"
" ","Informational","(Preview) Excessive upload via Palo Alto GlobalProtect","Anomaly","d0bd9611-2fc1-42cb-af4e-793b6f28ba92","This algorithm detects unusually high volume of upload per user account via Palo Alto VPN solution.
The model is trained on the previous 14 days of the VPN logs.
It indicates anomalous high volume of upload in the last day.","PaloAltoNetworks","","","Every 1 day",,"Available"
" ","Medium","TI map Domain entity to Syslog","Scheduled","532f62c1-fba6-4baa-bbb6-4a32a4ef32fa","Identifies a match in Syslog table from any Domain IOC from TI","Syslog|ThreatIntelligence|ThreatIntelligenceTaxii","Every 1 hour","Last 14 days","",,"Available"
" ","Medium","ClientDeniedAccess","Scheduled","a9956d3a-07a9-44a6-a279-081a85020cae","Creates an incident in the event a Client has an excessive amounts of denied access requests.","SymantecVIP","Every 1 hour","Last 1 hour","",,"Available"
