"Selected","Severity","DisplayName","Kind","Name","Description","RequiredDataConnectors","RuleFrequency","RulePeriod","RuleFrequency2","Version","Status"
" ","Low","New CloudShell User","Scheduled","6d7214d9-4a28-44df-aafb-0910b9e6ae3e","Identifies when a user creates an Azure CloudShell for the first time.
Monitor this activity to ensure only expected user are using CloudShell","AzureActivity","Every 1 day","Last 1 day","",,"Available"
" ","Low","SecurityEvent - Multiple authentication failures followed by a success","Scheduled","cf3ede88-a429-493b-9108-3e46d3c741f7","Identifies accounts who have failed to logon to the domain multiple times in a row, followed by a successful authentication
within a short time frame. Multiple failed attempts followed by a success can be an indication of a brute force attempt or
possible mis-configuration of a service account within an environment.
The lookback is set to 6h and the authentication window and threshold are set to 1h and 5, meaning we need to see a minimum
of 5 failures followed by a success for an account within 1 hour to surface an alert.","SecurityEvents|WindowsSecurityEvents","Every 6 hours","Last 6 hours","",,"Available"
" ","Low","Excessive Denied Proxy Traffic","Scheduled","7a58b253-0ef2-4248-b4e5-c350f15a8346","This alert creates an incident when a client generates an excessive amounts of denied proxy traffic.","SymantecProxySG","Every 1 hour","Last 1 hour","",,"Available"
" ","Medium","Attempts to sign in to disabled accounts","Scheduled","75ea5c39-93e5-489b-b1e1-68fa6c9d2d04","Identifies failed attempts to sign in to disabled accounts across multiple Azure Applications.
Default threshold for Azure Applications attempted to sign in to is 3.
References: https://docs.microsoft.com/azure/active-directory/reports-monitoring/reference-sign-ins-error-codes
50057 - User account is disabled. The account has been disabled by an administrator.","AzureActiveDirectory|AzureActiveDirectory","Every 1 day","Last 1 day","",,"Available"
" ","Medium","Failed AWS Console logons but success logon to AzureAD","Scheduled","910124df-913c-47e3-a7cd-29e1643fa55e","Identifies a list of IP addresses with a minimum numbe(default of 5) of failed logon attempts to AWS Console.
Uses that list to identify any successful Azure Active Directory logons from these IPs within the same timeframe.","AzureActiveDirectory|AWS","Every 1 day","Last 1 day","",,"Available"
" ","Low","Monitor AWS Credential abuse or hijacking","Scheduled","32555639-b639-4c2b-afda-c0ae0abefa55","Looking for GetCallerIdentity Events where the UserID Type is AssumedRole 
An attacker who has assumed the role of a legitimate account can call the GetCallerIdentity function to determine what account they are using.
A legitimate user using legitimate credentials would not need to call GetCallerIdentity since they should already know what account they are using.
More Information: https://duo.com/decipher/trailblazer-hunts-compromised-credentials-in-aws
AWS STS GetCallerIdentity API: https://docs.aws.amazon.com/STS/latest/APIReference/API_GetCallerIdentity.html ","AWS","Every 1 day","Last 1 day","",,"Available"
" ","Medium","User Accessed Suspicious URL Categories","Scheduled","fb0f4a93-d8ad-4b54-9931-85bdb7550f90","Creates an incident in the event the requested URL accessed by the user has been identified as Suspicious, Phishing, or Hacking.","SymantecProxySG","Every 1 hour","Last 1 hour","",,"Available"
" ","Medium","Distributed Password cracking attempts in AzureAD","Scheduled","bfb1c90f-8006-4325-98be-c7fffbc254d6","Identifies distributed password cracking attempts from the Azure Active Directory SigninLogs.
The query looks for unusually high number of failed password attempts coming from multiple locations for a user account.
References: https://docs.microsoft.com/azure/active-directory/reports-monitoring/reference-sign-ins-error-codes
50053   Account is locked because the user tried to sign in too many times with an incorrect user ID or password.
50055   Invalid password, entered expired password.
50056   Invalid or null password - Password does not exist in store for this user.
50126   Invalid username or password, or invalid on-premises username or password.","AzureActiveDirectory|AzureActiveDirectory","Every 1 day","Last 1 day","",,"Available"
" ","Medium","Powershell Empire cmdlets seen in command line","Scheduled","ef88eb96-861c-43a0-ab16-f3835a97c928","Identifies instances of PowerShell Empire cmdlets in powershell process command line data.","SecurityEvents|WindowsSecurityEvents","Every 12 hours","Last 12 hours","",,"Available"
" ","Medium","Potential DGA detected","Scheduled","a0907abe-6925-4d90-af2b-c7e89dc201a6","Identifies clients with a high NXDomain count which could be indicative of a DGA (cycling through possible C2 domains
where most C2s are not live). Alert is generated when a new IP address is seen (based on not being seen associated with 
NXDomain records in prior 10-day baseline period).","DNS","Every 1 day","Last 10 days","",,"Available"
" ","Medium","External guest invitations by default guest followed by Azure AD powershell signin","Scheduled","acc4c247-aaf7-494b-b5da-17f18863878a","By default guests have capability to invite more external guest user, who can do suspicious Azure AD enumeration. This detection will first look at guests 
inviting external guests users who are then logging via various powershell CLI after accepting invitation.
Ref : 'https://danielchronlund.com/2021/11/18/scary-azure-ad-tenant-enumeration-using-regular-b2b-guest-accounts/","AzureActiveDirectory|AzureActiveDirectory","Every 1 day","Last 1 day","",,"Available"
" ","Informational","AppServices AV Scan Failure","Scheduled","c2da1106-bfe4-4a63-bf14-5ab73130ccd5","Identifies if an AV scan fails in Azure App Services.","","Every 1 day","Last 1 day","",,"Available"
" ","Medium","Azure Active Directory Hybrid Health AD FS Suspicious Application","Scheduled","d9938c3b-16f9-444d-bc22-ea9a9110e0fd","This detection uses AzureActivity logs (Administrative category) to a suspicious application adding a server instance to an Azure AD Hybrid health AD FS service or deleting the AD FS service instance.
Usually the Azure AD Connect Health Agent application with ID cf6d7e68-f018-4e0a-a7b3-126e053fb88d is used to perform those operations.","AzureActivity","Every 1 day","Last 1 day","",,"Available"
" ","Informational","(Preview) Anomalous local account creation","Anomaly","c5644575-4982-4a07-8884-b11ec2866dc3","This algorithm is to detect anomalous local account creation on windows systems. Adversaries may create local accounts to maintain access to victim systems.
This algorithm analyzes historical local account creation activity (14 days) by users and compare with current day to find similar activity from the users who were not 
previously seen in historical activity. You can further customize the allowlist to filter known users from triggering this anomaly.","SecurityEvents","","","Every 1 day",,"Available"
" ","High","Exchange OAB Virtual Directory Attribute Containing Potential Webshell","Scheduled","faf1a6ff-53b5-4f92-8c55-4b20e9957594","This query uses Windows Event ID 5136 in order to detect potential webshell deployment by exploitation of CVE-2021-27065.
This query looks for changes to the InternalHostName or ExternalHostName properties of Exchange OAB Virtual Directory objects in AD Directory Services
where the new objects contain potential webshell objects. Ref: https://aka.ms/ExchangeVulns","SecurityEvents|WindowsSecurityEvents","Every 1 hour","Last 1 hour","",,"Available"
" ","Medium","Malware in the recycle bin (Normalized Process Events)","Scheduled","61988db3-0565-49b5-b8e3-747195baac6e","Identifies malware that has been hidden in the recycle bin.
To use this analytics rule, make sure you have deployed the [ASIM normalization parsers](https://aka.ms/AzSentinelProcessEvent)","","Every 1 day","Last 1 day","",,"Available"
" ","Medium","Azure DevOps Service Connection Addition/Abuse - Historic allow list","Scheduled","5efb0cfd-063d-417a-803b-562eae5b0301","This detection builds an allow list of historic service connection use by Builds and Releases and compares to recent history, flagging growth of service connection use which are not manually included in the allow list and 
not historically included in the allow list Build/Release runs.  This is to determine if someone is hijacking a build/release and adding many service connections in order to abuse or dump credentials from service connections.","","Every 6 hours","Last 14 days","",,"Available"
" ","Medium","Anomalous login followed by Teams action","Scheduled","2b701288-b428-4fb8-805e-e4372c574786","Detects anomalous IP address usage by user accounts and then checks to see if a suspicious Teams action is performed.
Query calculates IP usage Delta for each user account and selects accounts where a delta >= 90% is observed between the most and least used IP.
To further reduce results the query performs a prevalence check on the lowest used IP's country, only keeping IP's where the country is unusual for the tenant (dynamic ranges)
Finally the user accounts activity within Teams logs is checked for suspicious commands (modifying user privileges or admin actions) during the period the suspicious IP was active.","Office365|AzureActiveDirectory|AzureActiveDirectory","Every 1 day","Last 14 days","",,"Available"
" ","Medium","Azure DevOps Variable Secret Not Secured","Scheduled","4ca74dc0-8352-4ac5-893c-73571cc78331","Credentials used in the build process may be stored as Azure DevOps variables. To secure these variables they should be stored in KeyVault or marked as Secrets. 
This detection looks for new variables added with names that suggest they are credentials but where they are not set as Secrets or stored in KeyVault.","","Every 1 day","Last 1 day","",,"Available"
" ","Medium","Cisco Umbrella - Connection to non-corporate private network","Scheduled","c9b6d281-b96b-4763-b728-9a04b9fe1246","IP addresses of broadband links that usually indicates users attempting to access their home network, for example for a remote session to a home computer.","CiscoUmbrellaDataConnector","Every 10 minutes","Last 10 minutes","",,"Available"
" ","Medium","Cisco Umbrella - Connection to Unpopular Website Detected","Scheduled","75297f62-10a8-4fc1-9b2a-12f25c6f05a7","Detects first connection to an unpopular website (possible malicious payload delivery).","CiscoUmbrellaDataConnector","Every 1 day","Last 14 days","",,"Available"
" ","Medium","Excessive Failed Authentication from Invalid Inputs","Scheduled","c775a46b-21b1-46d7-afa6-37e3e577a27b","Creates an incident in the event that a user generates an excessive amount of failed authentications due to invalid inputs, indications of a potential brute force.","SymantecVIP","Every 1 hour","Last 1 hour","",,"Available"
" ","Medium","Brute force attack against a Cloud PC","Scheduled","3fbc20a4-04c4-464e-8fcb-6667f53e4987","Identifies evidence of brute force activity against a Windows 365 Cloud PC by highlighting multiple authentication failures and by a successful authentication within a given time window.","AzureActiveDirectory","Every 1 day","Last 1 day","",,"Available"
" ","Low","DNS events related to ToR proxies (Normalized DNS)","Scheduled","3fe3c520-04f1-44b8-8398-782ed21435f8","Identifies IP addresses performing DNS lookups associated with common ToR proxies.
To use this analytics rule, make sure you have deployed the [ASIM normalization parsers](https://aka.ms/AzSentinelDns)","","Every 1 day","Last 1 day","",,"Available"
" ","Medium","Cognni Incidents for Medium Sensitivity Governance Information","Scheduled","c1d4a005-e220-4d06-9e53-7326a22b8fe4","Display incidents in which medium sensitivity governance information was placed at risk by user sharing.","CognniSentinelDataConnector","Every 5 hours","Last 5 hours","",,"Available"
" ","Low","Chia_Crypto_Mining - Domain, Process, Hash and IP IOCs - June 2021","Scheduled","595a10c9-91be-4abb-bbc7-ae9c57848bef","Identifies a match across various data feeds for domains, process, hashes and IP IOC related to Chia cryptocurrency farming/plotting activity.","DNS|AzureMonitor(VMInsights)|F5|CiscoASA|PaloAltoNetworks|Fortinet|CheckPoint|CEF|MicrosoftThreatProtection|SecurityEvents|Office365|AzureFirewall|WindowsFirewall","Every 6 hours","Last 6 hours","",,"Available"
" ","Medium","TI map IP entity to Azure SQL Security Audit Events","Scheduled","d0aa8969-1bbe-4da3-9e76-09e5f67c9d85","Identifies a match in SQLSecurityAuditEvents from any IP IOC from TI","ThreatIntelligence|ThreatIntelligenceTaxii","Every 1 hour","Last 14 days","",,"Available"
" ","Informational","(Preview) Attempted computer bruteforce","Anomaly","8a602940-4153-4045-a741-3bf15591ae29","This algorithm detects an unusually high volume of failed login attempts to each computer. The model is trained on the previous 21 days of security event ID 4625 on a computer. It indicates anomalous high volume of failed login attempts in the last day.","SecurityEvents","","","Every 1 day",,"Available"
" ","High","Probable AdFind Recon Tool Usage (Normalized Process Events)","Scheduled","45076281-35ae-45e0-b443-c32aa0baf965","Identifies the host and account that executed AdFind by hash and filename in addition to common and unique flags that are used by many threat actors in discovery.
To use this analytics rule, make sure you have deployed the [ASIM normalization parsers](https://aka.ms/AzSentinelProcessEvent)","","Every 1 hour","Last 1 hour","",,"Available"
" ","Medium","TI map URL entity to PaloAlto data","Scheduled","106813db-679e-4382-a51b-1bfc463befc3","Identifies a match in PaloAlto data from any URL IOC from TI","PaloAltoNetworks|ThreatIntelligence|ThreatIntelligenceTaxii","Every 1 hour","Last 14 days","",,"Available"
" ","Medium","Brute Force Attack against GitHub Account","Scheduled","97ad74c4-fdd9-4a3f-b6bf-5e28f4f71e06","Attackers who are trying to guess your users' passwords or use brute-force methods to get in. If your organization is using SSO with Azure Active Directory, authentication logs to GitHub.com will be generated. Using the following query can help you identify a sudden increase in failed logon attempt of users.","AzureActiveDirectory|AzureActiveDirectory","Every 1 day","Last 1 day","",,"Available"
" ","High","Advanced Multistage Attack Detection","Fusion","f71aba3d-28fb-450b-b192-4e76a83015c8","Microsoft Sentinel uses Fusion, a correlation engine based on scalable machine learning algorithms, to automatically detect multistage attacks by identifying combinations of anomalous behaviors and suspicious activities that are observed at various stages of the kill chain. On the basis of these discoveries, Azure Sentinel generates incidents that would otherwise be very difficult to catch. By design, these incidents are low-volume, high-fidelity, and high-severity, which is why this detection is turned ON by default.

Since Fusion correlates multiple signals from various products to detect advanced multistage attacks, successful Fusion detections are presented as Fusion incidents on the Microsoft Sentinel Incidents page. This rule covers the following detections:
- Fusion for emerging threats
- Fusion for ransomware
- Scenario-based Fusion detections (122 scenarios)

To enable these detections, we recommend you configure the following data connectors for best results:
- Out-of-the-box anomaly detections
- Azure Active Directory Identity Protection
- Azure Defender
- Azure Defender for IoT
- Microsoft 365 Defender
- Microsoft Cloud App Security    
- Microsoft Defender for Endpoint
- Microsoft Defender for Identity
- Microsoft Defender for Office 365
- Palo Alto Networks
- Scheduled analytics rules, both built-in and those created by your security analysts. Analytics rules must contain kill-chain (tactics) and entity mapping information in order to be used by Fusion.

For the full description of each detection that is supported by Fusion, go to https://aka.ms/SentinelFusion.","","","","",,"Installed"
" ","Medium","NOBELIUM - Domain, Hash and IP IOCs - May 2021","Scheduled","677da133-e487-4108-a150-5b926591a92b","Identifies a match across various data feeds for domains, hashes and IP IOCs related to NOBELIUM.
Ref: https://www.microsoft.com/security/blog/2021/05/27/new-sophisticated-email-based-attack-from-nobelium/","DNS|AzureMonitor(VMInsights)|F5|CiscoASA|PaloAltoNetworks|Fortinet|CheckPoint|CEF|MicrosoftThreatProtection|SecurityEvents|Office365|AzureFirewall|WindowsFirewall","Every 6 hours","Last 6 hours","",,"Available"
" ","Medium","ProofpointPOD - Suspicious attachment","Scheduled","f6a51e2c-2d6a-4f92-a090-cfb002ca611f","Detects when email contains suspicious attachment (file type).","ProofpointPOD","Every 10 minutes","Last 10 minutes","",,"Available"
" ","Medium","Failed AzureAD logons but success logon to AWS Console","Scheduled","643c2025-9604-47c5-833f-7b4b9378a1f5","Identifies a list of IP addresses with a minimum number(defualt of 5) of failed logon attempts to Azure Active Directory.
Uses that list to identify any successful AWS Console logons from these IPs within the same timeframe.","AzureActiveDirectory|AzureActiveDirectory|AWS","Every 1 day","Last 1 day","",,"Available"
" ","High","Vectra AI Detect - Detections with High Severity","Scheduled","39e48890-2c02-487e-aa9e-3ba494061798","Create an incident for high severity malicious behavior detected by Vectra AI (Threat score superior to 7.0). 
The Severity is a mapping with the Threat score assigned to a detection. It ranges between 0 and 10. 
The severity_threshold variable can be adjusted as desired.' ","AIVectraDetect","Every 1 hour","Last 1 hour","",,"Available"
" ","Medium","TI map Email entity to SecurityEvent","Scheduled","2fc5d810-c9cc-491a-b564-841427ae0e50","Identifies a match in SecurityEvent table from any Email IOC from TI","ThreatIntelligence|ThreatIntelligenceTaxii|SecurityEvents","Every 1 hour","Last 14 days","",,"Available"
" ","Medium","(Preview) Anomalous SSH Login Detection","MLBehaviorAnalytics","fa118b98-de46-4e94-87f9-8e6d5060b60b","This detection uses machine learning (ML) to identify anomalous Secure Shell (SSH) login activity, based on syslog data. Scenarios include:

*	Unusual IP - This IP address has not or has rarely been seen in last 30 days.
*	Unusual Geo - The IP address, city, country and ASN have not (or rarely) been seen in last 30 days.
*	New user - A new user logs in from an IP address and geo location, both or either of which are not expected to be seen in the last 30 days.

Allow 7 days after this alert is enabled for Microsoft Sentinel to build a profile of normal activity for your environment.

This detection requires a specific configuration of the data source. [Learn more](https://docs.microsoft.com/en-us/azure/sentinel/connect-syslog#configure-the-syslog-connector-for-anomalous-ssh-login-detection)

By enabling this rule, you give Microsoft permission to copy ingested data outside of your Microsoft Sentinel workspace's geography as necessary for processing by the machine learning engine.","Syslog","","","",,"Available"
" ","High","High Urgency Cyberpion Action Items","Scheduled","8e0403b1-07f8-4865-b2e9-74d1e83200a4","This query creates an alert for active Cyberpion Action Items with high urgency (9-10).
 Urgency can be altered using the """"min_urgency"""" variable in the query.","CyberpionSecurityLogs","Every 1 day","Last 14 days","",,"Available"
" ","Medium","Azure VM Run Command operations executing a unique powershell script","Scheduled","5239248b-abfb-4c6a-8177-b104ade5db56","Identifies when Azure Run command is used to execute a powershell script on a VM that is unique.
The uniqueness of the powershell script is determined by taking a combined hash of the cmdlets it imports
and the filesize of the PowerShell script. Alerts from this detection indicate a unique PowerShell was executed
in your environment.","AzureActivity|MicrosoftThreatProtection","Every 1 day","Last 1 day","",,"Available"
" ","High","Cognni Incidents for Highly Sensitive Governance Information","Scheduled","2926ce29-08d2-4654-b2e8-7d8df70095d9","Display incidents in which highly sensitive governance information was placed at risk by user sharing.","CognniSentinelDataConnector","Every 5 hours","Last 5 hours","",,"Available"
" ",,"Create incidents based on Microsoft Defender for Identity alerts","MicrosoftSecurityIncidentCreation","40ba9493-4183-4eee-974f-87fe39c8f267","Create incidents based on all alerts generated in Microsoft Defender for Identity","AzureAdvancedThreatProtection","","","",,"Available"
" ","Medium","Azure AD Health Monitoring Agent Registry Keys Access","Scheduled","f819c592-c5f9-4d5c-a79f-1e6819863533","This detection uses Windows security events to detect suspicious access attempts to the registry key of Azure AD Health monitoring agent.
This detection requires an access control entry (ACE) on the system access control list (SACL) of the following securable object HKLM\SOFTWARE\Microsoft\Microsoft Online\Reporting\MonitoringAgent.
You can find more information in here https://github.com/OTRF/Set-AuditRule/blob/master/rules/registry/aad_connect_health_monitoring_agent.yml
","SecurityEvents","Every 1 day","Last 1 day","",,"Available"
" ","Informational","(Preview) Attempted user account bruteforce","Anomaly","ffe3625d-a933-4f63-b192-7e6ebf3be5fb","This algorithm detects an unusually high volume of failed login attempts per user account. The model is trained on the previous 21 days of security event ID 4625 on an account. It indicates anomalous high volume of failed login attempts in the last day.","SecurityEvents","","","Every 1 day",,"Available"
" ","Medium","GitHub Signin Burst from Multiple Locations","Scheduled","d3980830-dd9d-40a5-911f-76b44dfdce16","This alerts when there Signin burst from multiple locations in GitHub (AAD SSO).","AzureActiveDirectory|AzureActiveDirectory","Every 1 hour","Last 1 hour","",,"Available"
" ","Medium","AD FS Remote HTTP Network Connection","Scheduled","d57c33a9-76b9-40e0-9dfa-ff0404546410","This detection uses Sysmon events (NetworkConnect events) to detect incoming network traffic on port 80 on AD FS servers. This could be a sign of a threat actor
trying to use replication services on the AD FS server to get its configuration settings and extract sensitive information such as AD FS certificates.
In order to use this query you need to enable Sysmon telemetry on the AD FS Server.
Reference: https://twitter.com/OTR_Community/status/1387038995016732672
","SecurityEvents","Every 1 day","Last 1 day","",,"Available"
" ","High","Log4j vulnerability exploit aka Log4Shell IP IOC","Scheduled","6e575295-a7e6-464c-8192-3e1d8fd6a990","Identifies a match across various data feeds for IP IOCs related to the Log4j vulnerability exploit aka Log4Shell described in CVE-2021-44228.  
 References: https://cve.mitre.org/cgi-bin/cvename.cgi?name=2021-44228' ","Office365|DNS|AzureMonitor(VMInsights)|CiscoASA|PaloAltoNetworks|SecurityEvents|AzureActiveDirectory|AzureActiveDirectory|AzureMonitor(WireData)|AzureMonitor(IIS)|AzureActivity|AWS|MicrosoftThreatProtection|AzureFirewall","Every 1 hour","Last 1 hour","",,"Available"
" ","High","SUNBURST and SUPERNOVA backdoor hashes","Scheduled","a3c144f9-8051-47d4-ac29-ffb0c312c910","Identifies SolarWinds SUNBURST and SUPERNOVA backdoor file hash IOCs in DeviceFileEvents
References:
- https://www.fireeye.com/blog/threat-research/2020/12/evasive-attacker-leverages-solarwinds-supply-chain-compromises-with-sunburst-backdoor.html
- https://gist.github.com/olafhartong/71ffdd4cab4b6acd5cbcd1a0691ff82f","MicrosoftThreatProtection","Every 1 day","Last 1 day","",,"Available"
" ","Medium","IP with multiple failed Azure AD logins successfully logs in to Palo Alto VPN","Scheduled","ba144bf8-75b8-406f-9420-ed74397f9479","This query creates a list of IP addresses with a number failed login attempts to AAD 
above a set threshold.  It then looks for any successful Palo Alto VPN logins from any
of these IPs within the same timeframe.","AzureActiveDirectory|AzureActiveDirectory|PaloAltoNetworks","Every 1 day","Last 1 day","",,"Available"
" ","Medium","Known Malware Detected","Scheduled","9f86885f-f31f-4e66-a39d-352771ee789e","This creates an incident when a known Malware is detected on a endpoint managed by a Carbon Black.","VMwareCarbonBlack","Every 1 hour","Last 1 hour","",,"Available"
" ","Low","Rare and potentially high-risk Office operations","Scheduled","957cb240-f45d-4491-9ba5-93430a3c08be","Identifies Office operations that are typically rare and can provide capabilities useful to attackers.","Office365","Every 1 day","Last 1 day","",,"Available"
" ","Informational","(Preview) Suspicious volume of logins to computer","Anomaly","9c712bb2-08dc-44d3-b66b-af154dfc1c4f","This algorithm detects an unusually high volume of successful logins per computer. The model is trained on the previous 21 days of security event ID 4624 on a computer. It indicates anomalous high volume of successful logins in the last day","SecurityEvents","","","Every 1 day",,"Available"
" ","Medium","High count of connections by client IP on many ports","Scheduled","44a555d8-ecee-4a25-95ce-055879b4b14b","Identifies when 30 or more ports are used for a given client IP in 10 minutes occurring on the IIS server.
This could be indicative of attempted port scanning or exploit attempt at internet facing web applications.  
This could also simply indicate a misconfigured service or device.
References:
IIS status code mapping - https://support.microsoft.com/help/943891/the-http-status-code-in-iis-7-0-iis-7-5-and-iis-8-0
Win32 Status code mapping - https://msdn.microsoft.com/library/cc231199.aspx","AzureMonitor(IIS)","Every 1 day","Last 1 day","",,"Available"
