"Selected","Severity","DisplayName","Kind","Name","Description","RequiredDataConnectors","RuleFrequency","RulePeriod","RuleFrequency2","Version","Status"
" ","Medium","Cisco Umbrella - Empty User Agent Detected","Scheduled","2b328487-162d-4034-b472-59f1d53684a1","Rule helps to detect empty and unusual user agent indicating web browsing activity by an unusual process other than a web browser.","CiscoUmbrellaDataConnector","Every 15 minutes","Last 15 minutes","",,"Available"
" ","High","Azure DevOps Agent Pool Created Then Deleted","Scheduled","acfdee3f-b794-404a-aeba-ef6a1fa08ad1","As well as adding build agents to an existing pool to execute malicious activity within a pipeline, an attacker could create a complete new agent pool and use this for execution.
Azure DevOps allows for the creation of agent pools with Azure hosted infrastructure or self-hosted infrastructure. Given the additional customizability of self-hosted agents this 
detection focuses on the creation of new self-hosted pools. To further reduce false positive rates the detection looks for pools created and deleted relatively quickly (within 7 days by default), 
as an attacker is likely to remove a malicious pool once used in order to reduce/remove evidence of their activity.","","Every 7 days","Last 14 days","",,"Available"
" ","Low","Suspicious application consent for offline access","Scheduled","3533f74c-9207-4047-96e2-0eb9383be587","This will alert when a user consents to provide a previously-unknown Azure application with offline access via OAuth.
Offline access will provide the Azure App with access to the listed resources without requiring two-factor authentication.
Consent to applications with offline access and read capabilities should be rare, especially as the knownApplications list is expanded. Public contributions to expand this filter are welcome!
For further information on AuditLogs please see https://docs.microsoft.com/azure/active-directory/reports-monitoring/reference-audit-activities.","AzureActiveDirectory","Every 1 day","Last 14 days","",,"Available"
" ","High","Known CERIUM domains and hashes","Scheduled","c87fb346-ea3a-4c64-ba92-3dd383e0f0b5","CERIUM malicious webserver and hash values for maldocs and malware. 
 Matches domain name IOCs related to the CERIUM activity group with CommonSecurityLog, DnsEvents, and VMConnection dataTypes.","DNS|AzureMonitor(VMInsights)|CiscoASA|PaloAltoNetworks|AzureFirewall","Every 1 day","Last 1 day","",,"Available"
" ","Medium","TI map URL entity to SecurityAlert data","Scheduled","f30a47c1-65fb-42b1-a7f4-00941c12550b","Identifies a match in SecurityAlert data from any URL IOC from TI","MicrosoftCloudAppSecurity|AzureSecurityCenter|ThreatIntelligence|ThreatIntelligenceTaxii","Every 1 hour","Last 14 days","",,"Available"
" ","Low","Cognni Incidents for Low Sensitivity Legal Information","Scheduled","8374ec0f-d857-4c17-b1e7-93d11800f8fb","Display incidents in which low sensitivity legal information was placed at risk by user sharing.","CognniSentinelDataConnector","Every 5 hours","Last 5 hours","",,"Available"
" ","Informational","(Preview) Excessive Downloads via Palo Alto GlobalProtect","Anomaly","06107abb-1b68-4fdc-841b-8a1ff9301467","This algorithm detects unusually high volume of download per user account via Palo Alto VPN solution.
The model is trained on the previous 14 days of the VPN logs.
It indicates anomalous high volume of  downloads in the last day.","PaloAltoNetworks","","","Every 1 day",,"Available"
" ","Medium","A host is potentially running a crypto miner (ASIM Web Session schema)","Scheduled","8cbc3215-fa58-4bd6-aaaa-f0029c351730","This rule identifies a web request with a user agent header known to belong to a crypto miner. This indicates a crypto miner may have infected the client machine.<br>You can add custom crypto mining indicating User-Agent headers using a watchlist, for more information refer to the [UnusualUserAgents Watchlist](https://aka.ms/ASimUnusualUserAgentsWatchlist).<br><br>This rule uses the Advanced SIEM Information Model (ASIM) and supports any web session source that complies with ASIM. To use this Analytics Rule, deploy the [Advanced SIEM information Model (ASIM)](https://aka.ms/DeployASIM).","","Every 15 minutes","Last 15 minutes","",,"Available"
" ","Medium","TI map Domain entity to SecurityAlert","Scheduled","87890d78-3e05-43ec-9ab9-ba32f4e01250","Identifies a match in SecurityAlert table from any Domain IOC from TI","ThreatIntelligence|ThreatIntelligenceTaxii|MicrosoftCloudAppSecurity|AzureSecurityCenter","Every 1 hour","Last 14 days","",,"Available"
" ","Low","Palo Alto - possible internal to external port scanning","Scheduled","5b72f527-e3f6-4a00-9908-8e4fee14da9f","Identifies a list of internal Source IPs (10.x.x.x Hosts) that have triggered 10 or more non-graceful tcp server resets from one or more Destination IPs which 
results in an """"ApplicationProtocol = incomplete"""" designation. The server resets coupled with an """"Incomplete"""" ApplicationProtocol designation can be an indication 
of internal to external port scanning or probing attack. 
References: https://knowledgebase.paloaltonetworks.com/KCSArticleDetail?id=kA10g000000ClUvCAK and
https://knowledgebase.paloaltonetworks.com/KCSArticleDetail?id=kA10g000000ClTaCAK","PaloAltoNetworks","Every 1 hour","Last 1 hour","",,"Available"
" ","Medium","RDP Nesting","Scheduled","69a45b05-71f5-45ca-8944-2e038747fb39","Identifies when an RDP connection is made to a first system and then an RDP connection is made from the first system
to another system with the same account within the 60 minutes. Additionally, if historically daily
RDP connections are indicated by the logged EventID 4624 with LogonType = 10","SecurityEvents|WindowsSecurityEvents","Every 1 day","Last 8 days","",,"Available"
" ","Informational","(Preview) Suspicious volume of logins to computer with elevated token","Anomaly","9c27cee8-0a33-4abe-8683-212c0a98fc28","This algorithm detects an unusually high volume of successful logins with elevated token per computer. The model is trained on the previous 21 days of security event ID 4624 on a computer. It indicates anomalous high volume of successful logins with administrator privileges in the last day.","SecurityEvents","","","Every 1 day",,"Available"
" ","Low","Web sites blocked by Eset","Scheduled","84ad2f8a-b64c-49bc-b669-bdb4fd3071e9","Create alert on web sites blocked by Eset.","EsetSMC","Every 5 minutes","Last 5 minutes","",,"Available"
" ","Low","Failed login attempts to Azure Portal","Scheduled","223db5c1-1bf8-47d8-8806-bed401b356a4","Identifies failed login attempts in the Azure Active Directory SigninLogs to the Azure Portal.  Many failed logon 
attempts or some failed logon attempts from multiple IPs could indicate a potential brute force attack.  
The following are excluded due to success and non-failure results:
References: https://docs.microsoft.com/azure/active-directory/reports-monitoring/reference-sign-ins-error-codes
0 - successful logon
50125 - Sign-in was interrupted due to a password reset or password registration entry.
50140 - This error occurred due to 'Keep me signed in' interrupt when the user was signing-in.","AzureActiveDirectory|AzureActiveDirectory","Every 1 day","Last 7 days","",,"Available"
" ","Medium","Failed host logons but success logon to AzureAD","Scheduled","1ce5e766-26ab-4616-b7c8-3b33ae321e80","Identifies a list of IP addresses with a minimum number(default of 5) of failed logon attempts to remote hosts.
Uses that list to identify any successful logons to Azure Active Directory from these IPs within the same timeframe.","AzureActiveDirectory|AzureActiveDirectory|SecurityEvents|Syslog","Every 1 day","Last 1 day","",,"Available"
" ","Informational","(Preview) Login from an unusual region via Palo Alto GlobalProtect account logins","Anomaly","8546330c-e1fb-422a-9388-5c09e9a8f4ca","When a Palo Alto GlobalProtect account logs in from a source region that has rarely been logged in
from during the last 14 days, an anomaly is triggered. This anomaly may indicate that the account
has been compromised.","PaloAltoNetworks","","","Every 1 day",,"Available"
" ","Medium","Azure DevOps Service Connection Abuse","Scheduled","d564ff12-8f53-41b8-8649-44f76b37b99f","Flags builds/releases that use a large number of service connections if they aren't manually in the allow list.
This is to determine if someone is hijacking a build/release and adding many service connections in order to abuse 
or dump credentials from service connections.","","Every 1 day","Last 14 days","",,"Available"
" ","Medium","SUNSPOT log file creation","Scheduled","c0e84221-f240-4dd7-ab1e-37e034ea2a4e","This query uses Microsoft Defender for Endpoint data and Windows Event Logs to look for IoCs associated with the SUNSPOT malware shared by Crowdstrike.
More details: 
  - https://www.crowdstrike.com/blog/sunspot-malware-technical-analysis/ 
  - https://techcommunity.microsoft.com/t5/azure-sentinel/monitoring-your-software-build-process-with-azure-sentinel/ba-p/2140807","MicrosoftThreatProtection|SecurityEvents","Every 1 day","Last 1 day","",,"Available"
" ","Informational","(Preview) Anomalous scanning activity","Anomaly","2bb167bf-3951-435b-a932-8b03bfde0a2b","The Scanning Activity anomaly is looking to determine if there is potential port scanning anomaly in an environment coming from a single source IP to one or more destination IPs.  
The algorithm takes into account whether the IP is public, meaning external, or private, meaning internal, and the event is marked accordingly. Only private to public or public 
to private is considered at this time. Scanning activity can indicate an attacker attempting to determine available services in an environment that can be potentially 
exploited and used for ingress or lateral movement.
A high number of source ports and high number of destination ports from a single source IP to either a single or multiple destination IP or IPs can be interesting and indicate 
anomalous scanning. Additionally, if there is a high ratio of destination IPs to the single source IP this can indicate anomalous scanning.
Configuration details -
Job run default is daily, with hourly bins
The algorithm uses the following defaults to limit the results based on hourly bins, each is configurable
-> Included device actions - accept, allow, start
-> Excluded ports - 53, 67, 80, 8080, 123, 137, 138, 443, 445, 3389
-> Distinct destination port count >= 600
-> Distinct source port count >= 600
-> Distinct source port count divided by distinct destination port, ratio converted to percent >= 99.99
-> Source IP (always 1) divided by destination IP, ratio converted to percent >= 99.99","PaloAltoNetworks|Zscaler|CEF|CheckPoint|Fortinet","","","Every 1 day",,"Available"
" ","High","Privileged Accounts - Sign in Failure Spikes","Scheduled","34c5aff9-a8c2-4601-9654-c7e46342d03b"," Identifies spike in failed sign-ins from Privileged accounts. Privileged accounts list can be based on IdentityInfo UEBA table or built-in watchlist.
Spike is determined based on Time series anomaly which will look at historical baseline values.
Ref : https://docs.microsoft.com/azure/active-directory/fundamentals/security-operations-privileged-accounts#things-to-monitor","AzureActiveDirectory|AzureActiveDirectory","Every 1 day","Last 1 day","",,"Available"
" ","Medium","TI map IP entity to AWSCloudTrail","Scheduled","f110287e-1358-490d-8147-ed804b328514","Identifies a match in AWSCloudTrail from any IP IOC from TI","ThreatIntelligence|ThreatIntelligenceTaxii|AWS","Every 1 hour","Last 14 days","",,"Available"
" ","Informational","(Preview) Attempted user account bruteforce per logon type","Anomaly","c097bfdb-8b4b-4a98-b74d-1871ffd50a03","This algorithm detects an unusually high volume of failed login attempts per user account per logon type. The model is trained on the previous 21 days of security event ID 4625 on an account and a logon type. It indicates anomalous high volume of failed login attempts with certain logon type in the last day.","SecurityEvents","","","Every 1 day",,"Available"
" ","High","User Login from Different Countries within 3 hours","Scheduled","2954d424-f786-4677-9ffc-c24c44c6e7d5","This query searches for successful user logins to the Okta Console from different countries within 3 hours","OktaSSO","Every 3 hours","Last 3 hours","",,"Available"
" ","Medium","External Upstream Source Added to Azure DevOps Feed","Scheduled","adc32a33-1cd6-46f5-8801-e3ed8337885f","The detection looks for new external sources added to an Azure DevOps feed. An allow list can be customized to explicitly allow known good sources. 
An attacker could look to add a malicious feed in order to inject malicious packages into a build pipeline.","","Every 1 day","Last 1 day","",,"Available"
" ","Low","Suspicious Service Principal creation activity","Scheduled","6852d9da-8015-4b95-8ecf-d9572ee0395d","This alert will detect creation of an SPN, permissions granted, credentials cretaed, activity and deletion of the SPN in a time frame (default 10 minutes)","AzureActiveDirectory","Every 1 hour","Last 1 hour","",,"Available"
" ","Medium","TI map IP entity to SigninLogs","Scheduled","f2eb15bd-8a88-4b24-9281-e133edfba315","Identifies a match in SigninLogs from any IP IOC from TI","ThreatIntelligence|ThreatIntelligenceTaxii|AzureActiveDirectory|AzureActiveDirectory","Every 1 hour","Last 14 days","",,"Available"
" ","High","Vectra AI Detect - Suspected Compromised Host","Scheduled","60eb6cf0-3fa1-44c1-b1fe-220fbee23d63","Create an incident when a Host is suspected to be compromised. 
The higher the severity level is, the more immediate attention it requires as Vectra AI engine is more confident that this is a real threat. 
Level of severity are: Low, Medium, High, Critical). Recommended configuration is to trigger an alert for at least High and Critical.","AIVectraDetect","Every 1 hour","Last 1 hour","",,"Available"
" ","Informational","(Preview) Multi-region logins in a single day via Palo Alto GlobalProtect","Anomaly","03401f05-5c45-4f2d-9295-092764090e02","This algorithm detects a user account which had logins from multiple non-adjacent regions in a single day via Palo Alto VPN.","PaloAltoNetworks","","","Every 1 day",,"Available"
" ","High","Known STRONTIUM group domains - July 2019","Scheduled","074ce265-f684-41cd-af07-613c5f3e6d0d","Matches domain name IOCs related to Strontium group activity published July 2019 with CommonSecurityLog, DnsEvents and VMConnection dataTypes.
References: https://blogs.microsoft.com/on-the-issues/2019/07/17/new-cyberthreats-require-new-ways-to-protect-democracy/.","DNS|AzureMonitor(VMInsights)|CiscoASA|PaloAltoNetworks|AzureFirewall","Every 1 day","Last 1 day","",,"Available"
" ",,"Create incidents based on Microsoft Cloud App Security alerts","MicrosoftSecurityIncidentCreation","b3cfc7c0-092c-481c-a55b-34a3979758cb","Create incidents based on all alerts generated in Microsoft Cloud App Security","MicrosoftCloudAppSecurity","","","",,"Available"
" ","Low","Cognni Incidents for Low Sensitivity Financial Information","Scheduled","77171efa-4502-4ab7-9d23-d12305ff5a5e","Display incidents in which low sensitivity financial information was placed at risk by user sharing.","CognniSentinelDataConnector","Every 5 hours","Last 5 hours","",,"Available"
" ","Low","Multiple Teams deleted by a single user","Scheduled","173f8699-6af5-484a-8b06-8c47ba89b380","This detection flags the occurrences of deleting multiple teams within an hour.
This data is a part of Office 365 Connector in Microsoft Sentinel.","Office365","Every 1 day","Last 1 day","",,"Available"
" ","Low","User account added to built in domain local or global group","Scheduled","a35f2c18-1b97-458f-ad26-e033af18eb99","Identifies when a user account has been added to a privileged built in domain local group or global group 
such as the Enterprise Admins, Cert Publishers or DnsAdmins. Be sure to verify this is an expected addition.","SecurityEvents|WindowsSecurityEvents","Every 1 day","Last 1 day","",,"Available"
" ","Medium","SUNBURST suspicious SolarWinds child processes (Normalized Process Events)","Scheduled","631d02df-ab51-46c1-8d72-32d0cfec0720","Identifies suspicious child processes of SolarWinds.Orion.Core.BusinessLayer.dll that may be evidence of the SUNBURST backdoor
References:
- https://www.fireeye.com/blog/threat-research/2020/12/evasive-attacker-leverages-solarwinds-supply-chain-compromises-with-sunburst-backdoor.html
- https://gist.github.com/olafhartong/71ffdd4cab4b6acd5cbcd1a0691ff82f
To use this analytics rule, make sure you have deployed the [ASIM normalization parsers](https://aka.ms/AzSentinelProcessEvent)","","Every 1 day","Last 1 day","",,"Available"
" ","Low","Changes to AWS Security Group ingress and egress settings","Scheduled","4f19d4e3-ec5f-4abc-9e61-819eb131758c","A Security Group acts as a virtual firewall of an instance to control inbound and outbound traffic. 
 Hence, ingress and egress settings changes to AWS Security Group should be monitored as these can expose the enviornment to new attack vectors.
More information: https://medium.com/@GorillaStack/the-most-important-aws-cloudtrail-security-events-to-track-a5b9873f8255.","AWS","Every 1 day","Last 1 day","",,"Available"
" ","Medium","(Preview) Anomalous RDP Login Detections","MLBehaviorAnalytics","737a2ce1-70a3-4968-9e90-3e6aca836abf","This detection uses machine learning (ML) to identify anomalous Remote Desktop Protocol (RDP) login activity, based on Windows Security Event data. Scenarios include:

*	Unusual IP - This IP address has not or has rarely been seen in last 30 days.
*	Unusual Geo - The IP address, city, country and ASN have not (or rarely) been seen in last 30 days.
*	New user - A new user logs in from an IP address and geo location, both or either of which are not expected to be seen in the last 30 days.

Allow 7 days after this alert is enabled for Microsoft Sentinel to build a profile of normal activity for your environment.	

This detection requires a specific configuration of the data source. [Learn more](https://docs.microsoft.com/en-us/azure/sentinel/connect-windows-security-events)

By enabling this rule, you give Microsoft permission to copy ingested data outside of your Microsoft Sentinel workspace's geography as necessary for processing by the machine learning engine.","SecurityEvents","","","",,"Available"
" ","Medium","TI map IP entity to VMConnection","Scheduled","9713e3c0-1410-468d-b79e-383448434b2d","Identifies a match in VMConnection from any IP IOC from TI","ThreatIntelligence|ThreatIntelligenceTaxii|AzureMonitor(VMInsights)","Every 1 hour","Last 14 days","",,"Available"
" ","Medium","High count of failed attempts from same client IP","Scheduled","19e01883-15d8-4eb6-a7a5-3276cd668388","Identifies when 20 or more failed attempts from a given client IP in 1 minute occur on the IIS server.
This could be indicative of an attempted brute force. This could also simply indicate a misconfigured service or device.
Recommendations: Validate that these are expected connections from the given Client IP.  If the client IP is not recognized, 
potentially block these connections at the edge device.
If these are expected connections, verify the credentials are properly configured on the system, service, application or device 
that is associated with the client IP.
References:
IIS status code mapping: https://support.microsoft.com/help/943891/the-http-status-code-in-iis-7-0-iis-7-5-and-iis-8-0
Win32 Status code mapping: https://msdn.microsoft.com/library/cc231199.aspx","AzureMonitor(IIS)","Every 1 day","Last 1 day","",,"Available"
" ","High","Solorigate Defender Detections","Scheduled","e70fa6e0-796a-4e85-9420-98b17b0bb749","Surfaces any Defender Alert for Solorigate Events. In Microsoft Sentinel the SecurityAlerts table includes only the Device Name of the affected device, this query joins the DeviceInfo table to clearly connect other information such as 
 Device group, ip, logged on users etc. This way, the Microsoft Sentinel user can have all the pertinent device info in one view for all the the Solarigate Defender alerts.","MicrosoftDefenderAdvancedThreatProtection|MicrosoftThreatProtection","Every 1 day","Last 1 day","",,"Available"
" ","High","Known PHOSPHORUS group domains/IP - October 2020","Scheduled","7249500f-3038-4b83-8549-9cd8dfa2d498","Matches IOCs related to PHOSPHORUS group activity published October 2020 with CommonSecurityLog, DnsEvents, OfficeActivity and VMConnection dataTypes.
References: ","DNS|AzureMonitor(VMInsights)|CiscoASA|PaloAltoNetworks|Zscaler|Fortinet|OfficeATP|AzureFirewall","Every 1 day","Last 1 day","",,"Available"
" ","Low","Alsid Indicators of Attack","Scheduled","3caa67ef-8ed3-4ab5-baf2-3850d3667f3d","Searches for triggered Indicators of Attack","AlsidForAD","Every 2 hours","Last 2 hours","",,"Available"
" ","Medium","Azure DevOps Pull Request Policy Bypassing - Historic allow list","Scheduled","4d8de9e6-263e-4845-8618-cd23a4f58b70","This detection builds an allow list of historic PR policy bypasses and compares to recent history, flagging pull request bypasses that are not manually in the allow list and not historically included in the allow list.","","Every 3 hours","Last 14 days","",,"Available"
" ",,"Create incidents based on Microsoft Defender for Office 365 alerts","MicrosoftSecurityIncidentCreation","ee1d718b-9ed9-4a71-90cd-a483a4f008df","Create incidents based on all alerts generated in Microsoft Defender for Office 365","OfficeATP","","","",,"Available"
" ","Medium","AWS Guard Duty Alert","Scheduled","bf0cde21-0c41-48f6-a40c-6b5bd71fa106","Amazon GuardDuty is a threat detection service that continuously monitors your AWS accounts and workloads for malicious activity and delivers detailed security findings for visibility and remediation. This templates create an alert for each Amazon GuardDuty finding.","AWSS3","Every 5 hours","Last 5 hours","",,"Available"
" ",,"Create incidents based on Azure Defender for IOT alerts","MicrosoftSecurityIncidentCreation","a2e0eb51-1f11-461a-999b-cd0ebe5c7a72","Create incidents based on all alerts generated in Azure Defender for IOT","IoT","","","",,"Available"
" ","High","Azure DevOps Personal Access Token (PAT) misuse","Scheduled","ac891683-53c3-4f86-86b4-c361708e2b2b","This Alert detects whenever a PAT is used in ways that PATs are not normally used.  May require an allow list and baselining.
Reference - https://docs.microsoft.com/azure/devops/organizations/accounts/use-personal-access-tokens-to-authenticate?view=azure-devops&tabs=preview-page
Use this query for baselining:
AzureDevOpsAuditing
| distinct OperationName","","Every 1 hour","Last 1 hour","",,"Available"
" ","Medium","Vectra AI Detect - Suspicious Behaviors","Scheduled","6cb75f65-231f-46c4-a0b3-50ff21ee6ed3","Create an incident for each new malicious behavior detected by Vectra Detect. 
By default, it looks through all tactics. This can be modified to create incident only for a subset of tactics.","AIVectraDetect","Every 1 hour","Last 1 hour","",,"Available"
" ","Informational","(Preview) Anomalous Failed Sign-in","Anomaly","36f191f8-d1d1-4a22-8ba7-22c9b64a651a","Adversaries with no prior knowledge of legitimate credentials within the system or environment may guess passwords to attempt access to accounts.
Sentinel UEBA detects anomalies based on dynamic baselines created for each entity across various data inputs. Each entity’s baseline behavior is set according to its own historical activities, those of its peers, and those of the organization as a whole. Anomalies can be triggered by the correlation of different attributes such as action type, geo-location, device, resource, ISP, and more.
Supported data sources: Azure Sign-in, Windows security logs (Events 4624, 4625, 4672, 4648)","AzureActiveDirectory|SecurityEvents","","","Every 1 day",,"Available"
" ","Low","Multiple Password Reset by user","Scheduled","0b9ae89d-8cad-461c-808f-0494f70ad5c4","This query will determine multiple password resets by user across multiple data sources. 
Account manipulation including password reset may aid adversaries in maintaining access to credentials 
and certain permission levels within an environment.","AzureActiveDirectory|SecurityEvents|Syslog|Office365","Every 1 day","Last 1 day","",,"Available"
" ","High","Known Barium IP","Scheduled","6ee72a9e-2e54-459c-bc9a-9c09a6502a63","Identifies a match across various data feeds for IP IOCs related to the Barium activity group.  
 References: https://www.justice.gov/opa/pr/seven-international-cyber-defendants-including-apt41-actors-charged-connection-computer' ","Office365|DNS|AzureMonitor(VMInsights)|CiscoASA|PaloAltoNetworks|SecurityEvents|AzureActiveDirectory|AzureActiveDirectory|AzureMonitor(WireData)|AzureMonitor(IIS)|AzureActivity|AWS|MicrosoftThreatProtection|AzureFirewall","Every 1 day","Last 1 day","",,"Available"
" ","Low","Potential beaconing activity (ASIM Network Session schema)","Scheduled","fcb9d75c-c3c1-4910-8697-f136bfef2363","This rule identifies beaconing patterns from Network traffic logs based on recurrent frequency patterns. Such potential outbound beaconing pattern to untrusted public networks should be investigated for any malware callbacks or data exfiltration attempts as discussed in this [Blog](http://www.austintaylor.io/detect/beaconing/intrusion/detection/system/command/control/flare/elastic/stack/2017/06/10/detect-beaconing-with-flare-elasticsearch-and-intrusion-detection-systems/).\<br><br>This rule uses the [Advanced SIEM Information Model (ASIM)](https://aka.ms/AboutASIM) and supports any network session source that compiles with ASIM. To use this Analytics Rule, [deploy the Advanced SIEM information Model (ASIM)](https://aka.ms/DeployASIM).","","Every 1 day","Last 2 days","",,"Available"
